{
  "schema_version": "1.0",
  "run_id": "11111111-1111-4111-8111-111111111111",
  "parent_run_id": null,
  "started_at": "2026-08-02T10:00:00Z",
  "ended_at": "2026-08-16T12:00:00Z",
  "status": "succeeded",
  "evidence_mode": "real",
  "route": {
    "skill": "paid-measurement-loop",
    "version": "1.0.0",
    "reason_code": "fixture"
  },
  "context_manifests": [],
  "last_event_id": "22222222-2222-4222-8222-222222222222",
  "last_event_offset": 3,
  "last_event_hash": "aaaaaaaaaaaaaaaaaaaaaaaaaaaaaaaaaaaaaaaaaaaaaaaaaaaaaaaaaaaaaaaa",
  "save_point": {
    "ref": "memory/runs/11111111-1111-4111-8111-111111111111/save-points/002.json",
    "sha256": "bbbbbbbbbbbbbbbbbbbbbbbbbbbbbbbbbbbbbbbbbbbbbbbbbbbbbbbbbbbbbbbb"
  },
  "registry_offsets": {
    "entities": null,
    "creators": null,
    "claims": null,
    "consent": null,
    "launches": null,
    "channels": null,
    "narrative": null
  },
  "artifacts": [
    {
      "ref": "memory/control/measurement-1.json",
      "sha256": "cccccccccccccccccccccccccccccccccccccccccccccccccccccccccccccccc"
    }
  ],
  "metrics": {
    "turns": 2,
    "tool_calls": 1
  },
  "failure_class": null,
  "next_action": {
    "code": "review-cycle-retro"
  }
}
